text,intent
i need you to tell me what benefits are included in my insurance,insurance
please find the benefits provided by my insurance,insurance
what benefits do i have with my insurance,insurance
can you tell me what is included in my health benefits,insurance
please tell my what insurance plan i registered for,insurance
"i need to know what my health benefits cover, please",insurance
"i would like to hear a list of my insurance benefits, please",insurance
what is the insurance plan that i'm signed up for,insurance
please tell me what's provided in my health benefits,insurance
which insurance plan do i currently have,insurance
can you tell me the name of the insurance plan i'm a member of,insurance
remind me of which insurance plan i'm currently enrolled in,insurance
what benefits does my health coverage give me,insurance
i would like to know all of the covered benefits that are given by my health care plan,insurance
can you tell me what benefits i receive with my insurance,insurance
is there an insurance plan for my health,insurance
can i see my health benefits,insurance
what are the benefits i get for my health,insurance
what is the aid i get from these health benefits,insurance
can i obtain health benefits,insurance
give me info on my health plan,insurance
what was my health plan again,insurance
what health plan do i have,insurance
tell me my health plan,insurance
what's my health plan,insurance
"which insurance plan am i enrolled in, please",insurance
"what type of insurance plan am i enrolled in, please",insurance
what kind of insurance plan am i enrolled in,insurance
"what kind of insurance plan am i enrolled in, please",insurance
may i know my insurance benefits,insurance
where is the list of my insurance benefits,insurance
what's my insurance benefits like,insurance
how do i know my insurance benefits,insurance
what insurance benefits am i getting,insurance
how would you define my health benefits,insurance
will you summarize my health benefits,insurance
define my health benefits,insurance
how would you describe my health benefits,insurance
what is the definition of my health benefits,insurance
can you explain my benefits,insurance
whats included with my insurance,insurance
what insurance benefits do i have,insurance
what do my benefits look like,insurance
what benefits are included in my package,insurance
what are my insurance assets,insurance
what are my insurance advantages,insurance
what are my insurance perks,insurance
what are my insurance rewards,insurance
what are my insurance amenities,insurance
do you know what my health benefits are,insurance
please look up the name of my insurance plan,insurance
can you tell me the name of my insurance plan,insurance
i need to add the chore of vacuuming to my task list,todo_list_update
put wash the counters down on my list of pending tasks,todo_list_update
take doing the dishes off my todo list,todo_list_update
blank out my todo list,todo_list_update
erase all items on my todo list,todo_list_update
delete everything on my todo list,todo_list_update
add clean bathroom to my to do list,todo_list_update
go ahead and take cleaning the bathroom off my todo list,todo_list_update
you can remove vacuuming off the todo list,todo_list_update
make my todo list blank,todo_list_update
please take shoveling the car off my todo list,todo_list_update
i'd like you to remove throw away dvds off my todo list,todo_list_update
put clean stovetop on my list of reminders,todo_list_update
nuke all items on my todo list,todo_list_update
will you put change the light bulbs on my list of things to do,todo_list_update
delete everything from the task list,todo_list_update
hurry up and just erase everything from the todo list,todo_list_update
can you kindly clear my agenda list,todo_list_update
hey just take off everything from my todo list,todo_list_update
i don't want to do anything today so just clear the todo list,todo_list_update
please include feeding the fish on my to do list,todo_list_update
please remove laundry from my list of chores,todo_list_update
please clear out my whole to do list,todo_list_update
i want you to clear out my to do list,todo_list_update
i want you to add cleaning the toilet to my to do list,todo_list_update
make sure my to do list is completely clear please,todo_list_update
please include laundry on my to do list,todo_list_update
can you please add take out recycling on my list of chores to complete,todo_list_update
please get rid off everything on my to do list,todo_list_update
please take feeding the fish off of my list of tasks to complete,todo_list_update
i need to add dusting the bookshelf to my to do list,todo_list_update
please put washing the dishes on my list of tasks to accomplish,todo_list_update
please be sure to put folding laundry on my to do list for me,todo_list_update
please put watering the plants on my to do list,todo_list_update
please erase everything on my to do list,todo_list_update
take watering the plants off of my to do list,todo_list_update
"i just finished taking out my recycling, so cross that off my to do list",todo_list_update
can you check washing the dishes off on my to do list,todo_list_update
i need laundry put on my list of tasks to complete,todo_list_update
please add watering the plants to my current to do list,todo_list_update
to my domestic task list please add paint kitchen,todo_list_update
add to my task list get carpet cleaned,todo_list_update
add clean the bathroom to my task list,todo_list_update
put clean refrigerator on my spring cleaning to do list,todo_list_update
on my big project task list please add paint shutters in spring,todo_list_update
delete my to do list,todo_list_update
"erase get a haircut from my to do list, please",todo_list_update
i need to include a stop at the pharmacy to the list of things to do,todo_list_update
please cross off schedule acupuncture appointment off of the to do list,todo_list_update
please put my acupuncture appointment on my to list,todo_list_update
"can you add a trip to the post office to my to do list, please",todo_list_update
please also list wash laundry on my to do list,todo_list_update
will you please put remember to drop off at the dry cleaner's to my current to do list,todo_list_update
would you kindly remove five mile run from my list of things to do,todo_list_update
"let's go ahead and scratch laundry off my to do list, please!",todo_list_update
can you delete lunch with david from my to do list,todo_list_update
put dishes on to do list,todo_list_update
"on my to do list, add dishes",todo_list_update
i need to do dishes put it on my to do list,todo_list_update
add dishes to my list,todo_list_update
cleaning needs to be on my to do list,todo_list_update
please add cleaning on my list to do,todo_list_update
cleaning needs to go on my list of things to do,todo_list_update
"on my to do list, add cleaning",todo_list_update
i need to do cleaning so add it to my to do list,todo_list_update
"on my to do list, i need cleaning added",todo_list_update
put cleaning on my to do list,todo_list_update
please put cleaning on my list of things to do,todo_list_update
add cleaning to my to do list,todo_list_update
"on my list of things to do, add cleaning",todo_list_update
can you place laundry on my to do list,todo_list_update
help remind me that i need to add laundry to my list of housework,todo_list_update
if you could remind me about doing laundry i would appreciate it,todo_list_update
please remind me to add laundry to my list of chores,todo_list_update
add laundry to my list of shit to do,todo_list_update
add change filters to my to do list,todo_list_update
add schedule appraiser to my to do list,todo_list_update
add mop bathroom to my to do list,todo_list_update
add do laundry to my to do list,todo_list_update
put buy dog food on my to do list,todo_list_update
"on my to do list, add exercising",todo_list_update
remove all items from todo list,todo_list_update
add grocery shopping to my list of things to do,todo_list_update
clear out my entire todo list,todo_list_update
remove laundry from my todo list,todo_list_update
put laundry on my to do list,todo_list_update
nix folding laundry from my todo list,todo_list_update
add washing dishes to my to do list,todo_list_update
cross volunteering off my todo list,todo_list_update
take everything off my todo list,todo_list_update
i no longer need to wash dishes; take it of my list,todo_list_update
delete everything on my to do list,todo_list_update
mark down cleaning the bathroom on my list of things to do,todo_list_update
throw mopping onto my to do list,todo_list_update
can you remind me to mop later by putting it on my to do list today,todo_list_update
will you make sure that mopping is on my to do list,todo_list_update
will you add mopping to my to do list please,todo_list_update
can you put mopping on my to do list,todo_list_update
place cleaning the backyard on my list of things to do,todo_list_update
please put the meeting with carla on my to do list,todo_list_update
please link with my phone,sync_device
please connect the device to my phone,sync_device
please link up to my phone,sync_device
could you link with my phone,sync_device
please turn off your wifi from my phone,sync_device
please remove your connection to my phone,sync_device
please unlink my phone,sync_device
please get off my phone connection,sync_device
please desync my current mobile,sync_device
i no longer want this phone to sync,sync_device
please link up to my cell,sync_device
create a link with my phone,sync_device
stop syncing with this phone,sync_device
i don't want this phone synced any more,sync_device
desync from my iphone,sync_device
please immediately disconnect this mobile,sync_device
establish a connection to my phone,sync_device
my phone needs to be unsynced now,sync_device
could you unsync my phone please,sync_device
you can unsync from my phone now,sync_device
disconnect from my phone please,sync_device
please unsync phone from phone from home system,sync_device
i must disconnect from my phone,sync_device
go and disconnect from my phone,sync_device
you must connect to my phone,sync_device
please connect to my phone,sync_device
you have to connect to my phone,sync_device
go ahead and disconnect from my phone,sync_device
i wanna disconnect from my phone,sync_device
i need to disconnect from my phone,sync_device
you need to connect to my phone,sync_device
go ahead and connect to my phone,sync_device
get connected to my phone,sync_device
i want for you to connect to my phone,sync_device
disconnect from my phone for me,sync_device
would you disconnect from my phone,sync_device
help me to disconnect from my phone,sync_device
would you connect to my phone,sync_device
i need for you to connect to my phone,sync_device
i need you to disconnect from my phone,sync_device
i want for you to disconnect from my phone,sync_device
connect to my phone for me,sync_device
mind connecting to my phone,sync_device
connect with my phone please,sync_device
can you link to my phone,sync_device
will you connect to my phone,sync_device
please disconnect from my phone,sync_device
please connect with my phone,sync_device
please unsync from my phone,sync_device
pair with my smart phone,sync_device
i want you to disconnect from my phone,sync_device
unsync from my phone,sync_device
please connect with my smart phone,sync_device
"disconnect from my phone now, please",sync_device
could you connect to my phone,sync_device
"can you connect to my phone, please",sync_device
"disconnect from my phone, please",sync_device
"could you connect to my phone, please",sync_device
"can you connect with my phone, please",sync_device
"could you connect with my phone, please",sync_device
pair my phone please,sync_device
pair with my phone please,sync_device
with my phone please pair,sync_device
pair with my phone,sync_device
would you unsync the phone now please,sync_device
unsync my phone now please,sync_device
how can i unsync my phone,sync_device
go ahead an unsync my phone now,sync_device
unsync my phone,sync_device
please remove the phone's sync,sync_device
remove the sync from my phone,sync_device
please unsync my phone,sync_device
desync from my phone,sync_device
can we pair this with my new phone,sync_device
i would like to pair this with my new phone,sync_device
i am going to go ahead and pair this with my new phone,sync_device
lets pair this with my new phone,sync_device
i need to pair this with my phone,sync_device
use my phone and connect please,sync_device
would you please pair with my phone,sync_device
"initiate connection with my phone, please",sync_device
please begin pairing with my phone,sync_device
will you please end the connection to my phone,sync_device
you can disconnect from my phone now,sync_device
stop the connection with my phone,sync_device
let's terminate connection to my phone please,sync_device
i want you to connect using my phone,sync_device
i want to disconnect the current connection to my phone,sync_device
disconnect from my phone now,sync_device
disconnect from my phone,sync_device
i'd like you to disconnect from my phone,sync_device
do you think you could disconnect from my phone,sync_device
can you disconnect from my phone,sync_device
please get off my phone,sync_device
are you able to get into my phone at the moment,sync_device
can you get access to my phone right now,sync_device
do you have access to my phone,sync_device
are you able to link to my phone,sync_device
is my phone connectable right now,sync_device
quickly disconnect the phone,sync_device
let my credit card company know that my card split in half,damaged_card
how do you report a burned debit card,damaged_card
"my card split in half, how do i report it",damaged_card
report my burned card to the company,damaged_card
what do i say when i report a split credit card,damaged_card
my card was damaged by my cat; can i report that,damaged_card
i dropped my card in my gasoline and the printing wore off,damaged_card
i need to report that my dog chewed up my card,damaged_card
it seems i can't use my card since it has been damaged,damaged_card
"unfortunately, my card is damaged and unusable",damaged_card
what should i do with an unusable and damaged card,damaged_card
my card is unusable because it's damaged,damaged_card
i cracked my card and need a replacement,damaged_card
my card got melted and i need to report it,damaged_card
"my card got melted and i need to report it, please",damaged_card
"my card got melted in the dryer and i need to report it, please",damaged_card
my card got damaged and i need to report it,damaged_card
"my card got damaged and i need to report it, please",damaged_card
my card is damaged so i can not use it,damaged_card
report the card has been damaged,damaged_card
"i can not use my card, it is damaged",damaged_card
"the card is torn, let's report it",damaged_card
report that the card has been wrecked,damaged_card
my card is damaged and no longer function,damaged_card
my card is damaged and unusable,damaged_card
"my card is wrecked, let's report it",damaged_card
report the card has been torn,damaged_card
i can not use my card since it is damaged,damaged_card
i need to report a bent card,damaged_card
"my card split in half, can i report it",damaged_card
"i cracked my card, order a new one",damaged_card
report that i split my card,damaged_card
please make a report that my card is split,damaged_card
"the magnetic strip on my card is scratched, let the card company know",damaged_card
"i cut up the wrong card, please contact the bank and let them know",damaged_card
"i creased my card today, contact the bank",damaged_card
"my card is cracked, please tell the card company",damaged_card
"the dog chewed up my card, will you find out what it takes to get a replacement",damaged_card
the plastic numbers on my card are falling off,damaged_card
corner of my credit card is chipped off,damaged_card
my card got snapped in half,damaged_card
my card is too scratched and won't read correctly,damaged_card
the sticker on my card is peeling off,damaged_card
i can't use my card because it is broken,damaged_card
my broken card won't work,damaged_card
i can't use my damaged card,damaged_card
my damage card is not working,damaged_card
my damage card will not work,damaged_card
i don't know who to notify that i ran my credit card over with the lawn mower,damaged_card
i ran my credit card over with the lawn mower and need to replace it,damaged_card
i need to replace my credit card because i ran it over with the lawn mower,damaged_card
my card is partially damaged how do i report this,damaged_card
my card is not working and i need to let them know,damaged_card
my card broke in half and i need to report this,damaged_card
the chip on my card is damaged and i need a new one,damaged_card
my card's magnetic strip is not working and i want to notify them,damaged_card
my card has a deep crease through the middle so i would like to report it,damaged_card
how do i report my card if it got cut in half,damaged_card
my card is cracked and i want to report it,damaged_card
my card is too scratched up and i need to report it,damaged_card
i need to report my bent card,damaged_card
report to the company that i damaged my card,damaged_card
call the card company and ask them to replace my card,damaged_card
i damaged the card; can you replace the card,damaged_card
i demagnetized my card and want to report it,damaged_card
i want to report a broken card,damaged_card
"my phone was too close to my card and demagnetized it, how can i report this",damaged_card
my card has been erased and i need to report it,damaged_card
"i need a report form for my damaged, demagnetized card",damaged_card
how to report bent credit card,damaged_card
i can't use my broken card,damaged_card
i broke my card,damaged_card
how to tell the company that my credit card melted,damaged_card
my card is broken,damaged_card
my card isn't working,damaged_card
who do i report to if my credit card snaps,damaged_card
"i accidentally bent my card, what do i do",damaged_card
my card doesn't work anymore,damaged_card
how do i report a melted credit card,damaged_card
"my card needs replaced, i accidentally scraped it",damaged_card
"i'd like to report my card as damaged, it's bent",damaged_card
"i bent my card, can you report it to my bank",damaged_card
"my card got scratched badly, can you tell my bank to send a replacement",damaged_card
"my card snapped, can you tell my bank to send a replacement",damaged_card
i accidentally put my credit card in the shredder,damaged_card
my credit card fell out of my back pocket and got flushed down the toilet,damaged_card
my credit card snapped in half while i was fiddling with it,damaged_card
my dog ate my credit card and ruined it,damaged_card
i was using my credit card as a cutting board and accidentally sliced it in half,damaged_card
can you assist me with reporting that the atm nicked my card,damaged_card
i need to report a new card please the atm hurt mine,damaged_card
how report that scratched my card,damaged_card
the atm chewed up my card can i get a new one,damaged_card
"an atm ate my card, how do i report it",damaged_card
my card fell out of my wallet and i ran over it so it does not work,damaged_card
my card fell in the toilet and now the chip does not work,damaged_card
the magnetic strip on my card is scratched up pretty badly from overuse can i get a new one,damaged_card
i need a new card because my dog chewed on it and now it does not work,damaged_card
i want to report my damaged card i accidentally cut it up thinking it was my expired card,damaged_card
i cracked my rewards card can i get a different one,damaged_card
"when is the upcoming holiday, please",next_holiday
when is the upcoming holiday,next_holiday
what day is our next free day,next_holiday
when is the next scheduled holiday,next_holiday
"when is the next scheduled holiday, please",next_holiday
when is our next free day,next_holiday
"when is our next free day, please",next_holiday
"what day is our next free day, please",next_holiday
"what day is our next free day on the calendar, please",next_holiday
"when is the next holiday, please",next_holiday
are there any holidays this month,next_holiday
when is the next day i have off,next_holiday
how many more days until my next paid day off,next_holiday
which holiday is next in line,next_holiday
i need to know how long until my next vacation day,next_holiday
is there a holiday next week,next_holiday
how many days until i am off,next_holiday
when is my next vacation day,next_holiday
what's the time period till our next day off,next_holiday
how much time till the next day off,next_holiday
how much longer till the next day off,next_holiday
how much time till the next time off,next_holiday
how many days till we have off again,next_holiday
when's the next time i get a day off,next_holiday
when is the next scheduled day off,next_holiday
what's the next day i am scheduled off,next_holiday
what's the closest holiday after today,next_holiday
do i have a day off coming up soon,next_holiday
what is the next holiday on the calendar,next_holiday
how many days until my next day off,next_holiday
what holiday comes next,next_holiday
when will i get the next holiday with pay,next_holiday
when is the next time off for a holiday here,next_holiday
check when the next day is i can go fishing will be,next_holiday
when is the next office holiday,next_holiday
when does my current job have the next official paid holiday,next_holiday
what's the next scheduled holiday at this job,next_holiday
when will we next get to stay home from work,next_holiday
when's the next federally recognized holiday,next_holiday
when's the next time my job'll give me a day to myself,next_holiday
when does this place let us have a holiday next,next_holiday
let me know when my next day off is,next_holiday
can you tell me when our next day off is,next_holiday
when do i get a day off,next_holiday
give me the info of when our next day off is,next_holiday
show me my next day off,next_holiday
how many more weeks until the next holiday,next_holiday
which holiday is next,next_holiday
how many more days until the next holiday,next_holiday
how soon until the next holiday,next_holiday
tell me when i will next have the day off,next_holiday
tell me when the next holiday arrives,next_holiday
tell me when the next day off will be,next_holiday
please look up the next holiday for me,next_holiday
i need to know when i will next have the day off,next_holiday
find out for me when the next holiday will be,next_holiday
look up when our next day off will be,next_holiday
i need to know when the next holiday is,next_holiday
when can i expect my next day off,next_holiday
can you tell me what the next holiday is,next_holiday
do you know the date of my next day off,next_holiday
please tell me what the next holiday is,next_holiday
i need to know when the next holiday will be,next_holiday
i need to know when my next day off is,next_holiday
what is the date of the next holiday,next_holiday
how soon is my next day off,next_holiday
tell me when my next day off is,next_holiday
how long until my next day off,next_holiday
when will we have another day off,next_holiday
what is my next day off,next_holiday
whats the next day that i am off,next_holiday
how many days until the next holiday arrives,next_holiday
what day am i off next,next_holiday
how much longer until my next day off,next_holiday
when is my next day off,next_holiday
when will i be off again,next_holiday
to what extent until the following day away from work,next_holiday
to what extent until the following three day weekend,next_holiday
to what extent until the following free day,next_holiday
what is the next holiday,next_holiday
tell me what holiday is comming up next,next_holiday
are there any holiday's comming up,next_holiday
what holiday's are comming up next,next_holiday
when can i expect the next holiday here,next_holiday
is the next day off coming up,next_holiday
when's the next day off coming up,next_holiday
how long before the next day off is here,next_holiday
when is the next day off,next_holiday
when will the day off be,next_holiday
i need to know when i get my next day off,next_holiday
when do i finally get a day off,next_holiday
when don't i have to work next,next_holiday
what holiday can i expect next,next_holiday
do you know when my next day off is coming,next_holiday
what holiday is coming up next,next_holiday
when do i have some time off next,next_holiday
when's the next holiday coming,next_holiday
can you tell me the next holiday,next_holiday
what's the next holiday,next_holiday
what's the date of the next closest holiday,next_holiday
raise the volume to 4 please,change_volume
please set the volume to 4,change_volume
please increase the volume to 4,change_volume
please raise the volume to 4,change_volume
set the volume to 4 please,change_volume
bring the volume up overall,change_volume
make the volume louder,change_volume
bring the sound up,change_volume
turn your speakers up,change_volume
make the speakers louder,change_volume
lower your volume,change_volume
go ahead and increase the volume to 4 please,change_volume
you must increase the volume to 4 please,change_volume
go ahead and your volume,change_volume
you must increase your volume,change_volume
please increase your volume,change_volume
please increase your speaker volume,change_volume
go now and increase the volume to 4 please,change_volume
please increase the volume to 4 please,change_volume
i want to increase your volume,change_volume
i need you to your volume,change_volume
please your volume,change_volume
go ahead and increase your speaker volume,change_volume
i want you to your volume,change_volume
i need you to increase your volume,change_volume
i need you to increase your speaker volume,change_volume
please go ahead and increase your speaker volume,change_volume
make my volume louder please,change_volume
make the sound of my speaker greater,change_volume
